[
  {
    "legacy_id": "CONSTRUCTING_TIME",
    "kind": "global_entry",
    "source_file": "config/main.json",
    "source_layer": "stored",
    "content_version": "06e04320ce72422b3282211fa581bb48a5d3253a1c296d735f8b6b8c63d9f0b3",
    "key": "CONSTRUCTING_TIME",
    "value_type": "integer",
    "value": 1000
  },
  {
    "legacy_id": "ENERGY_INCREASE_ENERGY_INTERVAL",
    "kind": "global_entry",
    "source_file": "config/main.json",
    "source_layer": "stored",
    "content_version": "06e04320ce72422b3282211fa581bb48a5d3253a1c296d735f8b6b8c63d9f0b3",
    "key": "ENERGY_INCREASE_ENERGY_INTERVAL",
    "value_type": "integer",
    "value": 300000
  },
  {
    "legacy_id": "ENERGY_MAX_REGULAR_VALUE",
    "kind": "global_entry",
    "source_file": "config/main.json",
    "source_layer": "stored",
    "content_version": "06e04320ce72422b3282211fa581bb48a5d3253a1c296d735f8b6b8c63d9f0b3",
    "key": "ENERGY_MAX_REGULAR_VALUE",
    "value_type": "integer",
    "value": 30
  },
  {
    "legacy_id": "ENERGY_CONSTRUCTION_COST",
    "kind": "global_entry",
    "source_file": "config/main.json",
    "source_layer": "stored",
    "content_version": "06e04320ce72422b3282211fa581bb48a5d3253a1c296d735f8b6b8c63d9f0b3",
    "key": "ENERGY_CONSTRUCTION_COST",
    "value_type": "integer",
    "value": 1
  },
  {
    "legacy_id": "ENERGY_COSTS",
    "kind": "global_entry",
    "source_file": "config/main.json",
    "source_layer": "stored",
    "content_version": "06e04320ce72422b3282211fa581bb48a5d3253a1c296d735f8b6b8c63d9f0b3",
    "key": "ENERGY_COSTS",
    "value_type": "object",
    "value": {
      "10": 10,
      "20": 20,
      "30": 30,
      "40": 40
    }
  },
  {
    "legacy_id": "BASE_RESOURCE_LIMITS",
    "kind": "global_entry",
    "source_file": "config/main.json",
    "source_layer": "stored",
    "content_version": "06e04320ce72422b3282211fa581bb48a5d3253a1c296d735f8b6b8c63d9f0b3",
    "key": "BASE_RESOURCE_LIMITS",
    "value_type": "object",
    "value": {
      "g": 20000,
      "o": 20000,
      "s": 20000,
      "w": 20000
    }
  },
  {
    "legacy_id": "NUM_ACTIVE_MISSIONS",
    "kind": "global_entry",
    "source_file": "config/main.json",
    "source_layer": "stored",
    "content_version": "06e04320ce72422b3282211fa581bb48a5d3253a1c296d735f8b6b8c63d9f0b3",
    "key": "NUM_ACTIVE_MISSIONS",
    "value_type": "integer",
    "value": 5
  },
  {
    "legacy_id": "COLLECT_MINUTES",
    "kind": "global_entry",
    "source_file": "config/main.json",
    "source_layer": "stored",
    "content_version": "06e04320ce72422b3282211fa581bb48a5d3253a1c296d735f8b6b8c63d9f0b3",
    "key": "COLLECT_MINUTES",
    "value_type": "array",
    "value": [
      5,
      60,
      240,
      480
    ]
  },
  {
    "legacy_id": "COLLECT_MULTIPLIER",
    "kind": "global_entry",
    "source_file": "config/main.json",
    "source_layer": "stored",
    "content_version": "06e04320ce72422b3282211fa581bb48a5d3253a1c296d735f8b6b8c63d9f0b3",
    "key": "COLLECT_MULTIPLIER",
    "value_type": "array",
    "value": [
      0.25,
      1,
      2,
      3
    ]
  },
  {
    "legacy_id": "ENERGY_ASSIST_QTY",
    "kind": "global_entry",
    "source_file": "config/main.json",
    "source_layer": "stored",
    "content_version": "06e04320ce72422b3282211fa581bb48a5d3253a1c296d735f8b6b8c63d9f0b3",
    "key": "ENERGY_ASSIST_QTY",
    "value_type": "integer",
    "value": 1
  },
  {
    "legacy_id": "COST_HURRY_UP",
    "kind": "global_entry",
    "source_file": "config/main.json",
    "source_layer": "stored",
    "content_version": "06e04320ce72422b3282211fa581bb48a5d3253a1c296d735f8b6b8c63d9f0b3",
    "key": "COST_HURRY_UP",
    "value_type": "integer",
    "value": 2
  },
  {
    "legacy_id": "HEALTH_SPY_EAGLES",
    "kind": "global_entry",
    "source_file": "config/main.json",
    "source_layer": "stored",
    "content_version": "06e04320ce72422b3282211fa581bb48a5d3253a1c296d735f8b6b8c63d9f0b3",
    "key": "HEALTH_SPY_EAGLES",
    "value_type": "array",
    "value": [
      200,
      400,
      800,
      10000
    ]
  },
  {
    "legacy_id": "PRIZE_COLLECTIONS_CASH",
    "kind": "global_entry",
    "source_file": "config/main.json",
    "source_layer": "stored",
    "content_version": "06e04320ce72422b3282211fa581bb48a5d3253a1c296d735f8b6b8c63d9f0b3",
    "key": "PRIZE_COLLECTIONS_CASH",
    "value_type": "array",
    "value": [
      0,
      5,
      5,
      5,
      5,
      5,
      5,
      5,
      5,
      5,
      15,
      5,
      5,
      5,
      5,
      5,
      5,
      5,
      5,
      5,
      20
    ]
  },
  {
    "legacy_id": "MARKET_BASE_COSTS",
    "kind": "global_entry",
    "source_file": "config/main.json",
    "source_layer": "stored",
    "content_version": "06e04320ce72422b3282211fa581bb48a5d3253a1c296d735f8b6b8c63d9f0b3",
    "key": "MARKET_BASE_COSTS",
    "value_type": "object",
    "value": {
      "o": 100,
      "s": 150,
      "w": 100
    }
  },
  {
    "legacy_id": "MARKET_MAX_NUM_TRADES",
    "kind": "global_entry",
    "source_file": "config/main.json",
    "source_layer": "stored",
    "content_version": "06e04320ce72422b3282211fa581bb48a5d3253a1c296d735f8b6b8c63d9f0b3",
    "key": "MARKET_MAX_NUM_TRADES",
    "value_type": "integer",
    "value": 20
  },
  {
    "legacy_id": "MARKET_INCREMENT",
    "kind": "global_entry",
    "source_file": "config/main.json",
    "source_layer": "stored",
    "content_version": "06e04320ce72422b3282211fa581bb48a5d3253a1c296d735f8b6b8c63d9f0b3",
    "key": "MARKET_INCREMENT",
    "value_type": "number",
    "value": 0.02
  },
  {
    "legacy_id": "MARKET_MAX_INCREMENTS",
    "kind": "global_entry",
    "source_file": "config/main.json",
    "source_layer": "stored",
    "content_version": "06e04320ce72422b3282211fa581bb48a5d3253a1c296d735f8b6b8c63d9f0b3",
    "key": "MARKET_MAX_INCREMENTS",
    "value_type": "integer",
    "value": 200
  },
  {
    "legacy_id": "MARKET_MAX_DECREMENTS",
    "kind": "global_entry",
    "source_file": "config/main.json",
    "source_layer": "stored",
    "content_version": "06e04320ce72422b3282211fa581bb48a5d3253a1c296d735f8b6b8c63d9f0b3",
    "key": "MARKET_MAX_DECREMENTS",
    "value_type": "integer",
    "value": 25
  },
  {
    "legacy_id": "MARKET_SELL_PERCENTAGE",
    "kind": "global_entry",
    "source_file": "config/main.json",
    "source_layer": "stored",
    "content_version": "06e04320ce72422b3282211fa581bb48a5d3253a1c296d735f8b6b8c63d9f0b3",
    "key": "MARKET_SELL_PERCENTAGE",
    "value_type": "number",
    "value": 0.75
  },
  {
    "legacy_id": "MARKET_PERIOD_HOURS",
    "kind": "global_entry",
    "source_file": "config/main.json",
    "source_layer": "stored",
    "content_version": "06e04320ce72422b3282211fa581bb48a5d3253a1c296d735f8b6b8c63d9f0b3",
    "key": "MARKET_PERIOD_HOURS",
    "value_type": "integer",
    "value": 20
  },
  {
    "legacy_id": "MARKET_AMOUNT_TRADE",
    "kind": "global_entry",
    "source_file": "config/main.json",
    "source_layer": "stored",
    "content_version": "06e04320ce72422b3282211fa581bb48a5d3253a1c296d735f8b6b8c63d9f0b3",
    "key": "MARKET_AMOUNT_TRADE",
    "value_type": "array",
    "value": [
      100,
      200,
      300
    ]
  },
  {
    "legacy_id": "MIN_LEVEL_ATTACKS_1",
    "kind": "global_entry",
    "source_file": "config/main.json",
    "source_layer": "stored",
    "content_version": "06e04320ce72422b3282211fa581bb48a5d3253a1c296d735f8b6b8c63d9f0b3",
    "key": "MIN_LEVEL_ATTACKS_1",
    "value_type": "integer",
    "value": 10
  },
  {
    "legacy_id": "MIN_LEVEL_ATTACKS_2",
    "kind": "global_entry",
    "source_file": "config/main.json",
    "source_layer": "stored",
    "content_version": "06e04320ce72422b3282211fa581bb48a5d3253a1c296d735f8b6b8c63d9f0b3",
    "key": "MIN_LEVEL_ATTACKS_2",
    "value_type": "integer",
    "value": 15
  },
  {
    "legacy_id": "MIN_LEVEL_ATTACKS_3",
    "kind": "global_entry",
    "source_file": "config/main.json",
    "source_layer": "stored",
    "content_version": "06e04320ce72422b3282211fa581bb48a5d3253a1c296d735f8b6b8c63d9f0b3",
    "key": "MIN_LEVEL_ATTACKS_3",
    "value_type": "integer",
    "value": 20
  },
  {
    "legacy_id": "MIN_LEVEL_ATTACK_SIEGE_1",
    "kind": "global_entry",
    "source_file": "config/main.json",
    "source_layer": "stored",
    "content_version": "06e04320ce72422b3282211fa581bb48a5d3253a1c296d735f8b6b8c63d9f0b3",
    "key": "MIN_LEVEL_ATTACK_SIEGE_1",
    "value_type": "integer",
    "value": 25
  },
  {
    "legacy_id": "MIN_LEVEL_ATTACK_SIEGE_2",
    "kind": "global_entry",
    "source_file": "config/main.json",
    "source_layer": "stored",
    "content_version": "06e04320ce72422b3282211fa581bb48a5d3253a1c296d735f8b6b8c63d9f0b3",
    "key": "MIN_LEVEL_ATTACK_SIEGE_2",
    "value_type": "integer",
    "value": 30
  },
  {
    "legacy_id": "MIN_LEVEL_ATTACK_SIEGE_3",
    "kind": "global_entry",
    "source_file": "config/main.json",
    "source_layer": "stored",
    "content_version": "06e04320ce72422b3282211fa581bb48a5d3253a1c296d735f8b6b8c63d9f0b3",
    "key": "MIN_LEVEL_ATTACK_SIEGE_3",
    "value_type": "integer",
    "value": 35
  },
  {
    "legacy_id": "MAX_MINES_STONE",
    "kind": "global_entry",
    "source_file": "config/main.json",
    "source_layer": "stored",
    "content_version": "06e04320ce72422b3282211fa581bb48a5d3253a1c296d735f8b6b8c63d9f0b3",
    "key": "MAX_MINES_STONE",
    "value_type": "integer",
    "value": 1
  },
  {
    "legacy_id": "MAX_MINES_GOLD",
    "kind": "global_entry",
    "source_file": "config/main.json",
    "source_layer": "stored",
    "content_version": "06e04320ce72422b3282211fa581bb48a5d3253a1c296d735f8b6b8c63d9f0b3",
    "key": "MAX_MINES_GOLD",
    "value_type": "integer",
    "value": 1
  },
  {
    "legacy_id": "MAX_MINES_FOOD",
    "kind": "global_entry",
    "source_file": "config/main.json",
    "source_layer": "stored",
    "content_version": "06e04320ce72422b3282211fa581bb48a5d3253a1c296d735f8b6b8c63d9f0b3",